{
  "id": "boxing_body_uppercut",
  "style": "boxing",
  "name_key": "move.boxing.body_uppercut",
  "unlock_level": 3,
  "type": "body",
  "trajectory": "up",
  "limb": "right_hand",
  "height": "torso",
  "movement_variant": "static",
  "frames": {
    "startup": 10,
    "active": 3,
    "recovery": 16
  },
  "cancel_window": [
    13,
    21
  ],
  "range": 1.0,
  "damage": 8,
  "stamina": 6,
  "balance": 9,
  "on_block_frames": -4,
  "on_hit_frames": 2,
  "armor": false,
  "unblockable": false,
  "power": false,
  "impulse": 100,
  "fx": {
    "hitstop_ms": 75,
    "shake": 0.4,
    "sound": "impact_body"
  },
  "anim": "anims/boxing/body_uppercut.ozz"
}
