{
  "id": "boxing_cross",
  "style": "boxing",
  "name_key": "move.boxing.cross",
  "unlock_level": 1,
  "type": "straight",
  "trajectory": "straight",
  "limb": "right_hand",
  "height": "head",
  "movement_variant": "static",
  "frames": {
    "startup": 9,
    "active": 3,
    "recovery": 14
  },
  "cancel_window": [
    12,
    19
  ],
  "range": 1.3,
  "damage": 8,
  "stamina": 5,
  "balance": 8,
  "on_block_frames": -5,
  "on_hit_frames": 1,
  "armor": false,
  "unblockable": false,
  "power": false,
  "impulse": 110,
  "fx": {
    "hitstop_ms": 70,
    "shake": 0.4,
    "sound": "impact_medium_face"
  },
  "anim": "anims/boxing/cross.ozz"
}
