{
  "id": "boxing_pull_counter",
  "style": "boxing",
  "name_key": "move.boxing.pull_counter",
  "unlock_level": 5,
  "type": "counter",
  "trajectory": "straight",
  "limb": "right_hand",
  "height": "head",
  "movement_variant": "retreat",
  "frames": {
    "startup": 4,
    "active": 2,
    "recovery": 12
  },
  "cancel_window": [
    6,
    12
  ],
  "range": 1.3,
  "damage": 12,
  "stamina": 4,
  "balance": 15,
  "on_block_frames": -3,
  "on_hit_frames": 3,
  "armor": false,
  "unblockable": false,
  "power": false,
  "impulse": 160,
  "fx": {
    "hitstop_ms": 90,
    "shake": 0.6,
    "sound": "impact_counter"
  },
  "anim": "anims/boxing/pull_counter.ozz"
}
