{
  "id": "boxing_left_hook",
  "style": "boxing",
  "name_key": "move.boxing.left_hook",
  "unlock_level": 1,
  "type": "hook",
  "trajectory": "arc_left",
  "limb": "left_hand",
  "height": "head",
  "movement_variant": "static",
  "frames": {
    "startup": 11,
    "active": 3,
    "recovery": 16
  },
  "cancel_window": [
    14,
    22
  ],
  "range": 1.1,
  "damage": 10,
  "stamina": 6,
  "balance": 10,
  "on_block_frames": -4,
  "on_hit_frames": 2,
  "armor": false,
  "unblockable": false,
  "power": false,
  "impulse": 140,
  "fx": {
    "hitstop_ms": 85,
    "shake": 0.5,
    "sound": "impact_heavy_face"
  },
  "anim": "anims/boxing/left_hook.ozz"
}
